{
  "schema": "gummy.place-registry/v1",
  "id": "place-registry:gummy-os:first-party",
  "migrationSource": "gummy.application-registry/v1",
  "places": [
    {
      "schema": "gummy.place-descriptor/v1",
      "id": "app:videoboss",
      "name": "VideoBoss",
      "shortLabel": "VideoBoss",
      "actorId": "actor:videoboss",
      "actorAddress": "@videoboss",
      "placeClass": "studio",
      "canonicalSource": { "kind": "repository", "reference": "bohselecta/videoboss", "revision": "accepted-phase-13" },
      "legacyAliases": [],
      "standaloneTargets": ["web"],
      "surfaceModes": ["standalone", "production-context"],
      "authoritativeDataLocation": "VideoBoss repository and its project-scoped runtime",
      "domainSchemas": ["videoboss.production-export/r3"],
      "projectionSchemas": ["gummy.place-binding/v1"],
      "capabilityScopes": ["production.plan", "continuity.export"],
      "acceptedPackages": ["gummy.source-package/v1", "imagehoss.video-boss-handoff/r3"],
      "producedPackages": ["videoboss.production-export/r3", "gummy.place-handoff/v1"],
      "privacyBoundary": "Only an explicitly scoped Production package crosses into VideoBoss.",
      "executionBoundary": "Rendering remains separately approved and provider-backed.",
      "locality": ["browser", "remote"],
      "connectionState": "connected",
      "activationState": "available",
      "releaseTruth": "Planning and export are available; real rendering requires a separately connected provider.",
      "featureFlag": true
    },
    {
      "schema": "gummy.place-descriptor/v1",
      "id": "app:imagehoss",
      "name": "ImageHoss",
      "shortLabel": "ImageHoss",
      "actorId": "actor:imagehoss",
      "actorAddress": "@imagehoss",
      "placeClass": "studio",
      "canonicalSource": { "kind": "repository", "reference": "bohselecta/imagehoss", "revision": "accepted-phase-13" },
      "legacyAliases": [],
      "standaloneTargets": ["desktop"],
      "surfaceModes": ["standalone", "production-context"],
      "authoritativeDataLocation": "Authenticated local ImageHoss project",
      "domainSchemas": ["imagehoss.v5-1"],
      "projectionSchemas": ["gummy.place-binding/v1"],
      "capabilityScopes": ["visual-direction.edit", "asset.accept"],
      "acceptedPackages": ["gummy.source-package/v1"],
      "producedPackages": ["imagehoss.video-boss-handoff/r3", "gummy.place-handoff/v1"],
      "privacyBoundary": "Only selected references and their declared roles cross into the local project.",
      "executionBoundary": "Generation requires the authenticated local bridge and explicit production approval.",
      "locality": ["local"],
      "connectionState": "runtime-required",
      "activationState": "local-runtime-required",
      "releaseTruth": "Direction and package preparation work now; real images require the authenticated local runtime.",
      "featureFlag": true
    },
    {
      "schema": "gummy.place-descriptor/v1",
      "id": "app:3d-bee",
      "name": "Meshmallow",
      "shortLabel": "Meshmallow",
      "actorId": "actor:meshmallow",
      "actorAddress": "@meshmallow",
      "placeClass": "studio",
      "canonicalSource": { "kind": "repository", "reference": "bohselecta/3d-bee", "revision": "accepted-phase-13" },
      "legacyAliases": [],
      "standaloneTargets": ["desktop"],
      "surfaceModes": ["standalone", "production-context"],
      "authoritativeDataLocation": "Authenticated Meshmallow supervisor and Blender project",
      "domainSchemas": ["3d-bee.scene-package/r2d"],
      "projectionSchemas": ["gummy.place-binding/v1"],
      "capabilityScopes": ["scene-plan.edit", "blender-operation.execute-typed"],
      "acceptedPackages": ["gummy.source-package/v1", "gummy.world-plan/v1"],
      "producedPackages": ["3d-bee.scene-package/r2d", "gummy.place-handoff/v1"],
      "privacyBoundary": "Only the approved typed scene plan and selected assets cross into the local project.",
      "executionBoundary": "Blender work requires an authenticated supervisor and approval of the exact typed plan.",
      "locality": ["local"],
      "connectionState": "runtime-required",
      "activationState": "local-runtime-required",
      "releaseTruth": "Scene planning and package validation work now; real files require the authenticated local runtime.",
      "featureFlag": true
    },
    {
      "schema": "gummy.place-descriptor/v1",
      "id": "app:gummy-rooms",
      "name": "Gummy Rooms",
      "shortLabel": "Rooms",
      "actorId": "actor:gummy-rooms",
      "actorAddress": "@gummy-rooms",
      "placeClass": "connected-place",
      "canonicalSource": { "kind": "repository", "reference": "bohselecta/gummy2", "revision": "legacy-preserved" },
      "legacyAliases": [],
      "standaloneTargets": ["none"],
      "surfaceModes": ["session-context"],
      "authoritativeDataLocation": "A separately authenticated Gummy Rooms service",
      "domainSchemas": ["gummy2.rooms/legacy"],
      "projectionSchemas": ["gummy.place-binding/v1"],
      "capabilityScopes": ["room.join", "queue.fair-round-robin"],
      "acceptedPackages": ["gummy.source-package/v1"],
      "producedPackages": ["room-event", "gummy.place-handoff/v1"],
      "privacyBoundary": "Room membership never grants ambient access to personal or Production records.",
      "executionBoundary": "No room action executes until an authenticated service is connected.",
      "locality": ["local", "remote"],
      "connectionState": "service-required",
      "activationState": "remote-service-required",
      "releaseTruth": "Lineage is preserved; no authenticated Rooms service is connected.",
      "featureFlag": true
    },
    {
      "schema": "gummy.place-descriptor/v1",
      "id": "app:gummy-channels",
      "name": "Gummy Channels",
      "shortLabel": "Channels",
      "actorId": "actor:channels",
      "actorAddress": "@channels",
      "placeClass": "connected-place",
      "canonicalSource": { "kind": "repository", "reference": "bohselecta/vidfamtv", "revision": "52b439994104badb8d79eab406bf4984a9c909bc" },
      "legacyAliases": ["VidFam TV"],
      "standaloneTargets": ["android"],
      "surfaceModes": ["standalone", "personal", "production-context"],
      "authoritativeDataLocation": "Gummy Channels Android application and its channel service",
      "domainSchemas": ["gummy.channels-guide/v1", "gummy.family-room-bulletin/v1"],
      "projectionSchemas": ["gummy.channel-guide-projection/v1", "gummy.place-binding/v1"],
      "capabilityScopes": ["channel-guide.read", "bulletin.compose", "premiere.stage"],
      "acceptedPackages": ["gummy.source-package/v1"],
      "producedPackages": ["gummy.channel-premiere/v1", "gummy.place-handoff/v1"],
      "privacyBoundary": "Channel identity is separate; no contact, room, or Production data is ambiently available.",
      "executionBoundary": "Publishing is a separate approved action and stays staged until service safety gates pass.",
      "locality": ["mobile", "remote"],
      "connectionState": "companion-required",
      "activationState": "mobile-companion-required",
      "releaseTruth": "The local guide and installed Android route are materially complete. Production signing, Firebase, and remote publishing remain separately unavailable.",
      "featureFlag": true
    },
    {
      "schema": "gummy.place-descriptor/v1",
      "id": "app:gummy-wardrobe",
      "name": "Wardrobe",
      "shortLabel": "Wardrobe",
      "actorId": "actor:wardrobe",
      "actorAddress": "@wardrobe",
      "placeClass": "private-place",
      "canonicalSource": { "kind": "scaffold", "reference": "gummy-os/src/places/wardrobe", "revision": "phase-14" },
      "legacyAliases": ["Dressing Suite"],
      "standaloneTargets": ["pwa", "ios", "android"],
      "surfaceModes": ["personal", "companion-status", "capture-inbox"],
      "authoritativeDataLocation": "Owner-controlled local Wardrobe records",
      "domainSchemas": ["gummy.wardrobe-item/v1", "gummy.outfit/v1"],
      "projectionSchemas": ["gummy.wardrobe-projection/v1", "gummy.place-binding/v1"],
      "capabilityScopes": ["wardrobe.read-owned", "outfit.compose", "item.capture"],
      "acceptedPackages": ["gummy.source-package/v1"],
      "producedPackages": ["gummy.outfit/v1", "gummy.place-handoff/v1"],
      "privacyBoundary": "Wardrobe is private and exposes only explicitly selected owned items.",
      "executionBoundary": "No checkout or purchase action exists; mobile capture requires a truthful companion.",
      "locality": ["browser", "mobile"],
      "connectionState": "companion-required",
      "activationState": "mobile-companion-required",
      "releaseTruth": "Private outfit planning is fixture-backed; capture requires a mobile companion and there is no checkout.",
      "featureFlag": true
    },
    {
      "schema": "gummy.place-descriptor/v1",
      "id": "app:gummy-house",
      "name": "House",
      "shortLabel": "House",
      "actorId": "actor:house",
      "actorAddress": "@house",
      "placeClass": "private-place",
      "canonicalSource": { "kind": "repository", "reference": "bohselecta/homewright", "revision": "60963c3b4d8ae782d9b9ccdc31892625ff20230a" },
      "legacyAliases": ["Homewright"],
      "standaloneTargets": ["web", "pwa"],
      "surfaceModes": ["standalone", "personal", "production-context", "capture-inbox"],
      "authoritativeDataLocation": "House Home Graph",
      "domainSchemas": ["gummy.home-graph/v1", "gummy.house-commit/v1"],
      "projectionSchemas": ["gummy.house-project-projection/v1", "gummy.place-binding/v1"],
      "capabilityScopes": ["home-graph.read-scoped", "project.intent-stage", "capture.inbox"],
      "acceptedPackages": ["gummy.house-commit/v1"],
      "producedPackages": ["homewright.gummy-projection/v1", "gummy.place-handoff/v1"],
      "privacyBoundary": "The Scope Wall withholds address, photos, and unrelated Home Graph nodes unless explicitly selected.",